Submitted On,Full Name,Phone Number,Email Address,Project,City,Sales Owner,Status,Notes
2026-05-13 14:20:48,John Doe,+91 9876543210,john.doe@example.com,Meridian Tower,Mumbai,test@gmail.com,follow up,Client is asking to reschedule demo
2026-05-13 14:25:30,Sarah Johnson,9876543211,sarah.johnson@example.com,Eden Park,Bangalore,test@gmail.com,busy,"Person was busy, will try again next week"
2026-05-13 14:30:15,Rajesh Patel,+91-9876543212,rajesh.patel@example.com,Varah Swamy,Delhi,test@gmail.com,not interested,Not interested in our services
2026-05-13 14:35:22,Priya Singh,919876543213,priya.singh@example.com,Sarjapur Plots,Pune,test@gmail.com,closed,"Deal closed, onboarding in progress"
2026-05-13 15:00:00,No Contact Lead,,,,Kolkata,test@gmail.com,new,Should be skipped because no contact details
